[
  {
    "id": "balanced-plate",
    "title": "Build a balanced plate",
    "suggestion": "Try half a plate of vegetables, a quarter of protein such as dal, beans, tofu, eggs or fish, and a quarter of whole grains.",
    "questionIds": [
      "body_measurements",
      "waist",
      "waist_hip_ratio",
      "diabetes",
      "pcod",
      "diet",
      "sex"
    ],
    "relevance": {
      "anyOf": [
        {
          "questionId": "body_measurements",
          "operator": "risk_positive"
        },
        {
          "questionId": "waist",
          "operator": "risk_positive"
        },
        {
          "questionId": "waist_hip_ratio",
          "operator": "risk_positive"
        },
        {
          "questionId": "diabetes",
          "operator": "risk_positive"
        },
        {
          "questionId": "pcod",
          "operator": "risk_positive"
        },
        {
          "questionId": "diet",
          "operator": "not_contains",
          "value": "plants"
        }
      ],
      "allOf": [],
      "excludeIf": []
    },
    "tags": {
      "timeOfDay": [
        "day"
      ],
      "events": [
        "cooking"
      ],
      "categories": [
        "dietary"
      ]
    },
    "audience": "adults",
    "priority": "routine",
    "contextNotes": [
      "Adapt portions and food choices to your prescribed meal plan; kidney disease may need different protein and mineral targets."
    ],
    "sourceReferences": [
      {
        "sourceId": "nutrition_pdf",
        "pages": [
          1
        ]
      },
      {
        "sourceId": "wellness_pdf",
        "pages": [
          3,
          4
        ]
      },
      {
        "sourceId": "nih_diabetes"
      }
    ]
  },
  {
    "id": "whole-grain-swap",
    "title": "Make one whole-grain swap",
    "suggestion": "Swap a refined grain for oats, whole-wheat roti or another whole grain you enjoy.",
    "questionIds": [
      "diet",
      "waist",
      "waist_hip_ratio",
      "sex"
    ],
    "relevance": {
      "anyOf": [
        {
          "questionId": "diet",
          "operator": "not_contains",
          "value": "plants"
        },
        {
          "questionId": "waist",
          "operator": "risk_positive"
        },
        {
          "questionId": "waist_hip_ratio",
          "operator": "risk_positive"
        }
      ],
      "allOf": [],
      "excludeIf": []
    },
    "tags": {
      "timeOfDay": [
        "day"
      ],
      "events": [
        "shopping"
      ],
      "categories": [
        "dietary"
      ]
    },
    "audience": "adults",
    "priority": "routine",
    "contextNotes": [],
    "sourceReferences": [
      {
        "sourceId": "wellness_pdf",
        "pages": [
          3,
          4
        ]
      },
      {
        "sourceId": "who_diet"
      }
    ]
  },
  {
    "id": "vegetable-variety",
    "title": "Add another vegetable",
    "suggestion": "Add a vegetable to lunch or dinner and vary the colors across the week.",
    "questionIds": [
      "diet",
      "hypertension"
    ],
    "relevance": {
      "anyOf": [
        {
          "questionId": "diet",
          "operator": "not_contains",
          "value": "plants"
        },
        {
          "questionId": "hypertension",
          "operator": "risk_positive"
        }
      ],
      "allOf": [],
      "excludeIf": []
    },
    "tags": {
      "timeOfDay": [
        "day"
      ],
      "events": [
        "cooking"
      ],
      "categories": [
        "dietary"
      ]
    },
    "audience": "adults",
    "priority": "routine",
    "contextNotes": [
      "Follow any kidney-related potassium restrictions."
    ],
    "sourceReferences": [
      {
        "sourceId": "nutrition_pdf",
        "pages": [
          1
        ]
      },
      {
        "sourceId": "wellness_pdf",
        "pages": [
          3,
          4
        ]
      },
      {
        "sourceId": "who_diet"
      }
    ]
  },
  {
    "id": "legume-meal",
    "title": "Try a bean or lentil meal",
    "suggestion": "Include dal, chickpeas or beans in a meal for plant protein and fibre.",
    "questionIds": [
      "diet"
    ],
    "relevance": {
      "anyOf": [
        {
          "questionId": "diet",
          "operator": "not_contains",
          "value": "plants"
        },
        {
          "questionId": "diet",
          "operator": "not_contains",
          "value": "protein"
        }
      ],
      "allOf": [],
      "excludeIf": []
    },
    "tags": {
      "timeOfDay": [
        "day"
      ],
      "events": [
        "meals"
      ],
      "categories": [
        "dietary"
      ]
    },
    "audience": "adults",
    "priority": "routine",
    "contextNotes": [
      "Portion and potassium needs can differ with kidney disease."
    ],
    "sourceReferences": [
      {
        "sourceId": "wellness_pdf",
        "pages": [
          3,
          4
        ]
      },
      {
        "sourceId": "who_diet"
      }
    ]
  },
  {
    "id": "protein-meal",
    "title": "Include a protein food",
    "suggestion": "Add an appropriate portion of lentils, tofu, eggs, fish or another protein food to a meal.",
    "questionIds": [
      "diet"
    ],
    "relevance": {
      "anyOf": [
        {
          "questionId": "diet",
          "operator": "not_contains",
          "value": "protein"
        }
      ],
      "allOf": [],
      "excludeIf": []
    },
    "tags": {
      "timeOfDay": [
        "day"
      ],
      "events": [
        "cooking"
      ],
      "categories": [
        "dietary"
      ]
    },
    "audience": "adults",
    "priority": "routine",
    "contextNotes": [
      "Ask your dietitian about protein portions if you have kidney disease; this is not a high-protein prescription."
    ],
    "sourceReferences": [
      {
        "sourceId": "nutrition_pdf",
        "pages": [
          1
        ]
      },
      {
        "sourceId": "wellness_pdf",
        "pages": [
          3,
          4
        ]
      },
      {
        "sourceId": "who_diet"
      }
    ]
  },
  {
    "id": "healthy-fat-swap",
    "title": "Choose an unsaturated fat",
    "suggestion": "Use a small amount of olive, canola or another unsaturated oil instead of butter when cooking.",
    "questionIds": [
      "diet",
      "ischemic_heart_disease",
      "peripheral_vascular_disease"
    ],
    "relevance": {
      "anyOf": [
        {
          "questionId": "diet",
          "operator": "not_contains",
          "value": "fats"
        },
        {
          "questionId": "ischemic_heart_disease",
          "operator": "risk_positive"
        },
        {
          "questionId": "peripheral_vascular_disease",
          "operator": "risk_positive"
        }
      ],
      "allOf": [],
      "excludeIf": []
    },
    "tags": {
      "timeOfDay": [
        "day"
      ],
      "events": [
        "shopping"
      ],
      "categories": [
        "dietary"
      ]
    },
    "audience": "adults",
    "priority": "routine",
    "contextNotes": [],
    "sourceReferences": [
      {
        "sourceId": "wellness_pdf",
        "pages": [
          3,
          4
        ]
      },
      {
        "sourceId": "who_diet"
      },
      {
        "sourceId": "nih_kidney"
      }
    ]
  },
  {
    "id": "nuts-seeds",
    "title": "Add nuts or seeds thoughtfully",
    "suggestion": "Try a small serving of unsalted nuts or seeds as part of a balanced meal or snack.",
    "questionIds": [
      "diet",
      "late_snacks"
    ],
    "relevance": {
      "anyOf": [
        {
          "questionId": "diet",
          "operator": "not_contains",
          "value": "fats"
        },
        {
          "questionId": "late_snacks",
          "operator": "equals",
          "value": true
        }
      ],
      "allOf": [],
      "excludeIf": []
    },
    "tags": {
      "timeOfDay": [
        "day"
      ],
      "events": [
        "meals"
      ],
      "categories": [
        "dietary"
      ]
    },
    "audience": "adults",
    "priority": "routine",
    "contextNotes": [
      "Choose an allergy-safe option. Kidney-related potassium and phosphorus restrictions may change suitable choices."
    ],
    "sourceReferences": [
      {
        "sourceId": "wellness_pdf",
        "pages": [
          3,
          4
        ]
      },
      {
        "sourceId": "who_diet"
      }
    ]
  },
  {
    "id": "fibre-gradually",
    "title": "Build fibre gradually",
    "suggestion": "Add whole grains, vegetables or legumes gradually rather than changing everything at once.",
    "questionIds": [
      "diet",
      "body_measurements",
      "waist",
      "sex"
    ],
    "relevance": {
      "anyOf": [
        {
          "questionId": "diet",
          "operator": "not_contains",
          "value": "plants"
        },
        {
          "questionId": "body_measurements",
          "operator": "risk_positive"
        },
        {
          "questionId": "waist",
          "operator": "risk_positive"
        }
      ],
      "allOf": [],
      "excludeIf": []
    },
    "tags": {
      "timeOfDay": [
        "day"
      ],
      "events": [
        "shopping"
      ],
      "categories": [
        "dietary"
      ]
    },
    "audience": "adults",
    "priority": "routine",
    "contextNotes": [],
    "sourceReferences": [
      {
        "sourceId": "wellness_pdf",
        "pages": [
          2,
          3
        ]
      },
      {
        "sourceId": "wellness_pdf",
        "pages": [
          3,
          4
        ]
      },
      {
        "sourceId": "who_diet"
      }
    ]
  },
  {
    "id": "water-routine",
    "title": "Make water easy to reach",
    "suggestion": "Keep water available and drink regularly through the day, following your own fluid needs.",
    "questionIds": [
      "diet"
    ],
    "relevance": {
      "anyOf": [
        {
          "questionId": "diet",
          "operator": "not_contains",
          "value": "water"
        }